{
  "areaSource": "data/areas/vertical-slice-v0.geojson",
  "candidateCount": 10293,
  "candidateSource": "data/candidates/osm/features.geojson",
  "counts": {
    "environmental": 2,
    "hero/reference": 5,
    "ordinary building": 8,
    "road/intersection": 5,
    "walkway/pedestrian": 5
  },
  "generatedAt": "2026-08-17",
  "humanReviewStatus": "pending",
  "lifecycle": "human-review",
  "missingRequiredHeroes": [],
  "priorityStatus": "pass",
  "quotas": {
    "environmental": 2,
    "hero/reference": 5,
    "ordinary building": 8,
    "road/intersection": 5,
    "walkway/pedestrian": 5
  },
  "requiredHeroes": [
    "UPLB Oblation",
    "UPLB Freedom Park",
    "Charles Fuller Baker Memorial Hall",
    "DL Umali Auditorium",
    "Main Library"
  ],
  "rows": [
    {
      "aliases": [
        "UPLB Oblation"
      ],
      "approximatePosition": {
        "lat": 14.165,
        "lon": 121.24155
      },
      "areaOrLength": {
        "kind": "none",
        "unit": "m",
        "value": 0.0
      },
      "candidateId": "candidate:osm:node/382803333",
      "category": "hero/reference",
      "confidence": {
        "facade": "unknown",
        "footprint": "unknown",
        "height": "unknown",
        "position": "medium"
      },
      "currentDecision": "pending",
      "evidenceAttributes": {
        "referenceConfidence": "reference-only"
      },
      "externalIds": {
        "osm": "node/382803333"
      },
      "featureType": "landmark",
      "geometryReason": "valid",
      "geometryStatus": "valid",
      "name": "UPLB Oblation",
      "priorityScore": [
        1.0,
        1.0,
        12.0,
        1.0,
        -0.0
      ],
      "provenance": [
        "source:osm:uplb-aoi@2026-08-17"
      ],
      "recommendedAction": "confirm required hero identity, geometry, aliases, and source rights before promotion",
      "registryMatch": "uplb:landmark:oblation",
      "reviewHistory": [],
      "reviewStatus": "pending",
      "sourceGeometry": {
        "coordinates": [
          121.24155,
          14.165
        ],
        "type": "Point"
      },
      "sourceGeometryHash": "sha256:c3e1c41d88c3c25e99698729ef8ba42ccd71560d4b589fb9a6bfa18967c0d5ca"
    },
    {
      "aliases": [
        "ULKC",
        "Main Library"
      ],
      "approximatePosition": {
        "lat": 14.1628993,
        "lon": 121.2398575
      },
      "areaOrLength": {
        "kind": "area",
        "unit": "m2",
        "value": 3595.677
      },
      "candidateId": "candidate:osm:way/1098780830",
      "category": "hero/reference",
      "confidence": {
        "facade": "unknown",
        "footprint": "medium",
        "height": "unknown",
        "position": "medium"
      },
      "currentDecision": "pending",
      "evidenceAttributes": {
        "building": "construction",
        "geometryReason": "valid",
        "geometryState": "valid",
        "layer": "1",
        "originalGeometryHash": "sha256:dc7ab6437576d75d964a4e3cf8eb28ec410a0d81aaedeff1831c95a50af2a76c",
        "osmTags": {
          "alt_name": "ULKC",
          "building": "construction",
          "layer": "1",
          "name": "University Library and Knowledge Center"
        }
      },
      "externalIds": {
        "osm": "way/1098780830"
      },
      "featureType": "building",
      "geometryReason": "valid",
      "geometryStatus": "valid",
      "name": "University Library and Knowledge Center",
      "priorityScore": [
        1.0,
        0.0,
        17.0,
        1.0,
        -0.0
      ],
      "provenance": [
        "source:osm:uplb-aoi@2026-08-17"
      ],
      "recommendedAction": "confirm required hero identity, geometry, aliases, and source rights before promotion",
      "registryMatch": null,
      "reviewHistory": [],
      "reviewStatus": "pending",
      "sourceGeometry": {
        "coordinates": [
          [
            [
              121.2395023,
              14.1631069
            ],
            [
              121.2396487,
              14.1627595
            ],
            [
              121.2397391,
              14.1625452
            ],
            [
              121.2401979,
              14.162727
            ],
            [
              121.2400663,
              14.1630392
            ],
            [
              121.239961,
              14.1632887
            ],
            [
              121.2398509,
              14.1632457
            ],
            [
              121.2397789,
              14.1632175
            ],
            [
              121.2397141,
              14.1631916
            ],
            [
              121.2395023,
              14.1631069
            ]
          ]
        ],
        "type": "Polygon"
      },
      "sourceGeometryHash": "sha256:dc7ab6437576d75d964a4e3cf8eb28ec410a0d81aaedeff1831c95a50af2a76c"
    },
    {
      "aliases": [
        "DL Umali Auditorium"
      ],
      "approximatePosition": {
        "lat": 14.1640174,
        "lon": 121.2401157
      },
      "areaOrLength": {
        "kind": "area",
        "unit": "m2",
        "value": 1740.539
      },
      "candidateId": "candidate:osm:way/33541381",
      "category": "hero/reference",
      "confidence": {
        "facade": "unknown",
        "footprint": "medium",
        "height": "medium",
        "position": "medium"
      },
      "currentDecision": "pending",
      "evidenceAttributes": {
        "building": "yes",
        "geometryReason": "valid",
        "geometryState": "valid",
        "levels": 1.0,
        "originalGeometryHash": "sha256:6cfd4cae3fd9252015f40671dcd844be8e235b6b34d4d2a9e3cbe6afa2cf5ffe",
        "osmTags": {
          "amenity": "theatre",
          "building": "yes",
          "building:levels": "1",
          "building:material": "concrete",
          "building:underground": "1",
          "name": "Dioscoro L. Umali Hall",
          "roof:material": "eternit",
          "roof:shape": "flat",
          "start_date": "1969",
          "theatre:type": "stage"
        }
      },
      "externalIds": {
        "osm": "way/33541381"
      },
      "featureType": "building",
      "geometryReason": "valid",
      "geometryStatus": "valid",
      "name": "Dioscoro L. Umali Hall",
      "priorityScore": [
        1.0,
        0.0,
        17.0,
        1.0,
        -0.0
      ],
      "provenance": [
        "source:osm:uplb-aoi@2026-08-17"
      ],
      "recommendedAction": "confirm required hero identity, geometry, aliases, and source rights before promotion",
      "registryMatch": null,
      "reviewHistory": [],
      "reviewStatus": "pending",
      "sourceGeometry": {
        "coordinates": [
          [
            [
              121.2403709,
              14.1638068
            ],
            [
              121.2403443,
              14.1638582
            ],
            [
              121.2401346,
              14.1642815
            ],
            [
              121.2398926,
              14.1641767
            ],
            [
              121.2401204,
              14.1636822
            ],
            [
              121.2402621,
              14.1637527
            ],
            [
              121.2403709,
              14.1638068
            ]
          ]
        ],
        "type": "Polygon"
      },
      "sourceGeometryHash": "sha256:6cfd4cae3fd9252015f40671dcd844be8e235b6b34d4d2a9e3cbe6afa2cf5ffe"
    },
    {
      "aliases": [
        "UPLB Freedom Park"
      ],
      "approximatePosition": {
        "lat": 14.16128,
        "lon": 121.24173
      },
      "areaOrLength": {
        "kind": "none",
        "unit": "m",
        "value": 0.0
      },
      "candidateId": "candidate:osm:way/33541968",
      "category": "hero/reference",
      "confidence": {
        "facade": "unknown",
        "footprint": "unknown",
        "height": "unknown",
        "position": "medium"
      },
      "currentDecision": "pending",
      "evidenceAttributes": {
        "referenceConfidence": "reference-only"
      },
      "externalIds": {
        "osm": "way/33541968"
      },
      "featureType": "landmark",
      "geometryReason": "valid",
      "geometryStatus": "valid",
      "name": "UPLB Freedom Park",
      "priorityScore": [
        1.0,
        1.0,
        12.0,
        1.0,
        -0.0
      ],
      "provenance": [
        "source:osm:uplb-aoi@2026-08-17"
      ],
      "recommendedAction": "confirm required hero identity, geometry, aliases, and source rights before promotion",
      "registryMatch": "uplb:landmark:freedom-park",
      "reviewHistory": [],
      "reviewStatus": "pending",
      "sourceGeometry": {
        "coordinates": [
          121.24173,
          14.16128
        ],
        "type": "Point"
      },
      "sourceGeometryHash": "sha256:d82c3d955f3c53032def43c6d42503e554568cd94124b9d234fcc4640621201c"
    },
    {
      "aliases": [
        "Baker Hall",
        "Charles Fuller Baker Memorial Hall"
      ],
      "approximatePosition": {
        "lat": 14.1617583,
        "lon": 121.242771
      },
      "areaOrLength": {
        "kind": "area",
        "unit": "m2",
        "value": 1639.319
      },
      "candidateId": "candidate:osm:way/37449973",
      "category": "hero/reference",
      "confidence": {
        "facade": "unknown",
        "footprint": "medium",
        "height": "medium",
        "position": "medium"
      },
      "currentDecision": "pending",
      "evidenceAttributes": {
        "building": "yes",
        "geometryReason": "valid",
        "geometryState": "valid",
        "levels": 2.0,
        "originalGeometryHash": "sha256:453a6ff16f9a8a5f99be1d9dd8f1eef5831f4b57afac3b1ff9a061fb3a0407f9",
        "osmTags": {
          "addr:city": "Los Baños",
          "addr:postcode": "4031",
          "addr:street": "Mariano M. Mondoñedo Avenue",
          "alt_name": "Baker Hall",
          "building": "yes",
          "building:levels": "2",
          "building:material": "concrete",